{
  "mapping_file": "../../arquivos_mapeamento/conversao_pg-trd-44_shp-trd-44.json",
  "direction": "A=>B",
  "source": {
    "type": "postgis",
    "host": "localhost",
    "port": 5432,
    "database": "trd44",
    "user": "postgres",
    "password": "postgres",
    "schema": "mgcp",
    "srid": 4674,
    "tables": []
  },
  "destination": {
    "type": "shapefile",
    "path": "D:/output/shp_trd44/",
    "srid": 4674,
    "encoding": "UTF-8"
  },
  "options": {
    "clip_geometry": null,
    "clip_file": null,
    "reproject_to": null,
    "log_file": "logs/trd44_shp_trd44.log",
    "error_action": "skip",
    "batch_size": 10000
  }
}
